level,heading
2,エロ通話アプリおすすめ6選
3,おすすめ1位はVI-VO
3,おすすめ2位はジュエルライブ
3,おすすめ3位はエンジェルライブ
3,おすすめ4位はマダムライブ
3,おすすめ5位はFANZAライブチャット
3,おすすめ6位はライブでゴーゴー
2,エロ通話アプリの選び方
3,本人確認と運営会社の信頼性で選ぶ
3,通話料金とポイント換算率で選ぶ
3,初回無料ポイントの多さで選ぶ
3,登録している女性の人数で選ぶ
3,好みの女性ジャンルで選ぶ
3,割引キャンペーンの充実度で選ぶ
2,エロ通話アプリとはどのようなサービスなのか
3,女性とリアルタイムで通話できる仕組み
3,一般的なライブチャットとの違い
3,出会い系アプリとの違い
3,ポイント制を中心とした料金システム
2,エロ通話アプリで楽しめること
3,二人きりのビデオ通話を楽しめる
3,のぞきチャットで相手の映像を視聴できる
3,遠隔操作に対応したおもちゃで遊べる
3,映像を使わず音声通話を楽しめる
3,テキストチャットで会話できる
3,好みの女性を選んで通話できる
3,お気に入り登録した女性と継続的に交流できる
2,エロ通話アプリを無料ポイントで楽しむ方法
3,複数のエロ通話アプリで初回無料ポイントを試す
3,のぞき機能で相手の雰囲気を確認する
2,エロ通話アプリに関するよくある質問
3,エロ通話アプリは完全無料で利用できますか
3,女性はどこまでリクエストに対応してくれますか
3,特殊なプレイをお願いすることはできますか
3,男性は顔出しをせずに利用できますか
3,利用中に身元が知られる危険はありますか
3,エロ通話アプリにサクラや業者はいますか
3,通話画面の録画やスクリーンショットは可能ですか
3,通話した女性と実際に会うことはできますか
3,エロ通話アプリは簡単に退会できますか
2,エロ通話アプリのおすすめまとめ